<?xml version='1.0' encoding='UTF-8' ?>

<!ENTITY % common SYSTEM "common.dtd">
%common;

<!-- <sitemap> is the root element -->
<!ELEMENT sitemap (title, summary?, seealso*, category*)>

<!ATTLIST sitemap metafile CDATA  #REQUIRED>

<!-- <indexpage> is another root element -->
<!ELEMENT indexpage (parentdocument, title, category*)>

<!ATTLIST indexpage metafile CDATA  #REQUIRED>

<!ELEMENT category (title, page*, modulefilelist? )>
<!ATTLIST category id ID #IMPLIED>

<!ELEMENT page (#PCDATA)>
<!ATTLIST page href CDATA #IMPLIED
               separate (yes | no) "no" >

<!ELEMENT modulefilelist (modulefile*) >
<!ELEMENT modulefile (#PCDATA) >
